{
  "REAL_SCIENTIFIC_ANALYSIS_AUTHORIZED": true,
  "allow_capture_radius": false,
  "allow_change_statistics": false,
  "allow_cross_backend_analysis": true,
  "allow_modify_analysis_code": false,
  "allow_modify_formal_results": false,
  "allow_primary_exact_permutation": true,
  "allow_read_frozen_formal_results": true,
  "allow_reassociation_analysis": true,
  "allow_registration": false,
  "allow_scientific_aggregation": true,
  "allow_secondary_rotation": true,
  "allow_systematic_component_analysis": true,
  "analysis_code_commit": "215a7961ed93dac9cf691e1e8ccd99d7ee868175",
  "analysis_control_commit": "6ef9197d36a0c5a73878a7191172d2a27a9a5dae",
  "analysis_lock_file_sha256": "5796f70ca9b5e58d729ada5ace3d817d913aea24d7c2132e8984dadc4df2311c",
  "analysis_lock_fingerprint": "407114966420e471ebb4f50229eb980c9da8c304ce3479fa3ac36960407953ac",
  "analysis_lock_release_commit": "65f2b6ea4c977ea3161f6ecc1c31d05894f1f494",
  "analysis_lock_revision": 2,
  "analysis_lock_sha256": "5796f70ca9b5e58d729ada5ace3d817d913aea24d7c2132e8984dadc4df2311c",
  "analysis_output_root": "/home/lj/ZPRM/results/mid360_formal_batch1/zero_perturbation_locked_analysis_results_v1",
  "analysis_output_schema_sha256": "707e2d5f7030c090a30ebb5cfb74f07373e04a223ac1beae94e53bc502eec23e",
  "authorization_basis": "EXPLICIT_USER_INSTRUCTION_RECORDED_BY_OPERATOR",
  "authorization_id": "FMB1_ZP_LOCKED_ANALYSIS_AUTH_AA7F1D6E3A237D7C526397C680ECC0B1",
  "authorization_scope": "ONE_AUTHORITATIVE_LOCKED_SCIENTIFIC_ANALYSIS_RUN",
  "authorization_type": "ONE_TIME_FMB1_LOCKED_SCIENTIFIC_ANALYSIS",
  "c2_clarification_commit": "364c0ae76801c373d9ea6a4d9dd36e2fdf211e09",
  "consumed": false,
  "fixture_only": false,
  "formal_results_root": "/home/lj/ZPRM/results/mid360_formal_batch1/zero_perturbation_v1_1_execution_v1",
  "immutable": true,
  "issued_at_utc": "2026-08-20T12:41:05.432479Z",
  "lifecycle_state": "VERIFIED_PUBLISHED",
  "locked_analysis_code_commit": "215a7961ed93dac9cf691e1e8ccd99d7ee868175",
  "nonce": "aa7f1d6e3a237d7c526397c680ecc0b1",
  "postrun_verification_commit": "18bb94e62761f5193da8cdc5509c470cb4983244",
  "postrun_verification_root": "/home/lj/ZPRM/results/mid360_formal_batch1/zero_perturbation_v1_1_postrun_verification_v1",
  "published_at_utc": "2026-08-20T12:41:19.824122Z",
  "r3_lock_fingerprint": "fd601e8daf62c488a3a079beea05f65c9bd283399ae4d7f3acf16e63fc473a6d",
  "raw_execution_commit": "059e39533991d929a97ab208ad738643af82d09a",
  "reusable": false,
  "schema": "fmb1_formal_analysis_authorization_v1",
  "track_id": "ZERO_PERTURBATION_TRACK",
  "verification_report_sha256": "f23043215c3fbca06dbb90c71e8e1ef30a5d93e3f5ffa02acb6e10d4598a3734"
}
